<!DOCTYPE Treatment SYSTEM "treatment.dtd">
<Treatment Name="Boob Job" ShortName="BbJb" Title="Patient">
    <Description>
        She will undergo surgery to "enhance" her bust.
        *(Takes up to 3 turns per level, less if a Nurse is on duty)
    </Description>

    <Surgery Duration="3" />

    <Messages>
        <Message Name="surgery">
            <Text>${name} is in the Clinic to get her breasts enlarged.</Text>
        </Message>

        <Message Name="doctor.work">
            <Text>Today, she enhanced ${name}'s boobs.</Text>
        </Message>

        <Message Name="no-effect-possible">
            <Text>${name} already has Titanic Tits.</Text>
        </Message>

        <Include>DefaultSurgeryMessages.xml</Include>
    </Messages>
</Treatment>
